{
  "$schema": "https://json-schema.org/draft/2020-12/schema",
  "$id": "https://mini-format.pmoluna.com/source/evidencia/esquemas/estudio.schema.json",
  "title": "mini-format/estudios/1",
  "description": "Registro de estudios (evidencia/estudios.json). Dos ejes independientes: estado_ejecucion y resultado. Las reglas de honestidad que no expresa un esquema (ejecutado exige corridas reales de todos los componentes; cumple/no_cumple se recalcula desde los predicados) las comprueba tools/evidencia.py estudios.",
  "type": "object",
  "required": ["esquema", "objetivo", "estudios"],
  "properties": {
    "esquema": { "const": "mini-format/estudios/1" },
    "objetivo": { "const": "OE4" },
    "descripcion": { "type": "string" },
    "clasificacion_metodologica": { "type": "string" },
    "estudios": { "type": "array", "minItems": 10, "items": { "$ref": "#/$defs/estudio" } }
  },
  "additionalProperties": false,
  "$defs": {
    "fecha": { "type": "string", "pattern": "^\\d{4}-\\d{2}-\\d{2}T\\d{2}:\\d{2}:\\d{2}Z$" },
    "estudio": {
      "type": "object",
      "required": ["id", "nombre", "objetivo", "clasificacion", "pregunta", "procedimiento", "muestra", "comparadores", "criterio",
                   "meta_documental", "componentes", "limitaciones", "reproduccion", "hu_relacionadas", "estado_ejecucion", "resultado",
                   "bloqueo", "antecedentes"],
      "additionalProperties": false,
      "properties": {
        "id": { "enum": ["V1", "V2", "V3a", "V3b", "V4", "V5", "V6a", "V6b", "V7", "V8"] },
        "nombre": { "type": "string", "minLength": 1 },
        "objetivo": { "const": "OE4" },
        "clasificacion": {
          "type": "object",
          "required": ["tipo", "formativo_sumativo"],
          "properties": {
            "tipo": { "enum": ["controlado", "naturalista", "exploratorio"], "description": "V1-V5 y V6b controlados; V6a naturalista; V7 y V8 exploratorios." },
            "formativo_sumativo": { "type": "string", "description": "Otra dimensión, independiente del tipo." }
          },
          "additionalProperties": false
        },
        "pregunta": { "type": "string", "minLength": 1 },
        "procedimiento": { "type": "string", "minLength": 1 },
        "muestra": { "type": "object", "required": ["unidad", "descripcion"], "properties": { "unidad": { "type": "string" }, "descripcion": { "type": "string" } }, "additionalProperties": false },
        "comparadores": { "type": "array", "items": { "type": "string" } },
        "criterio": { "oneOf": [{ "type": "null" }, { "$ref": "#/$defs/criterio" }] },
        "meta_documental": { "type": "string", "minLength": 1 },
        "componentes": { "type": "array", "minItems": 1, "items": { "$ref": "#/$defs/componente" } },
        "cifras": { "type": "array", "items": { "$ref": "#/$defs/cifra" } },
        "limitaciones": { "type": "array", "minItems": 1, "items": { "type": "string" } },
        "reproduccion": {
          "type": "object",
          "required": ["comando", "nota"],
          "properties": { "comando": { "type": ["string", "null"] }, "nota": { "type": "string", "minLength": 1 } },
          "additionalProperties": false
        },
        "hu_relacionadas": { "type": "array", "minItems": 1, "items": { "type": "string", "pattern": "^HU\\d{3}$" } },
        "estado_ejecucion": { "enum": ["pendiente", "bloqueado", "parcial", "ejecutado"] },
        "resultado": { "enum": ["no_evaluable", "cumple", "no_cumple"] },
        "bloqueo": {
          "oneOf": [
            { "type": "null" },
            { "type": "object", "required": ["causa"], "properties": { "causa": { "type": "string", "minLength": 1 }, "desbloquea": { "type": "string" } }, "additionalProperties": false }
          ]
        },
        "antecedentes": { "type": "array", "items": { "$ref": "#/$defs/antecedente" } }
      },
      "allOf": [
        { "if": { "properties": { "estado_ejecucion": { "const": "bloqueado" } } }, "then": { "properties": { "bloqueo": { "type": "object" } } } },
        { "if": { "properties": { "resultado": { "enum": ["cumple", "no_cumple"] } } }, "then": { "properties": { "estado_ejecucion": { "const": "ejecutado" }, "criterio": { "type": "object" } } } },
        { "if": { "properties": { "clasificacion": { "properties": { "tipo": { "const": "exploratorio" } } } } }, "then": { "properties": { "criterio": { "type": "null" }, "resultado": { "const": "no_evaluable" } } } }
      ]
    },
    "criterio": {
      "type": "object",
      "required": ["texto", "interpretacion", "fijado_utc", "aprobado_por_equipo", "predicados"],
      "additionalProperties": false,
      "properties": {
        "texto": { "type": "string", "minLength": 1 },
        "interpretacion": { "type": "string", "minLength": 1, "description": "Fijada ANTES del análisis." },
        "fijado_utc": { "$ref": "#/$defs/fecha" },
        "aprobado_por_equipo": { "type": "boolean" },
        "predicados": { "type": "array", "minItems": 1, "items": { "$ref": "#/$defs/predicado" } }
      }
    },
    "predicado": {
      "type": "object",
      "required": ["id", "descripcion", "fuente", "ruta", "agregacion", "op", "valor"],
      "additionalProperties": false,
      "properties": {
        "id": { "type": "string", "pattern": "^[a-z][a-z0-9_]{1,60}$" },
        "descripcion": { "type": "string" },
        "fuente": { "enum": ["resumen", "corridas"], "description": "resumen: ruta dentro de manifiesto.resumen; corridas: ruta dentro del propio manifiesto (p. ej. modelo.proveedor)." },
        "ruta": { "type": "string", "minLength": 1 },
        "agregacion": { "enum": ["min", "max", "suma", "unico", "conteo_distintos", "conteo_distintos_familia"] },
        "op": { "enum": [">=", "<=", ">", "<", "=="] },
        "valor": { "type": "number" }
      }
    },
    "componente": {
      "type": "object",
      "required": ["id", "descripcion", "procedencias_admitidas", "minimo_corridas"],
      "additionalProperties": false,
      "properties": {
        "id": { "type": "string", "pattern": "^[a-z][a-z0-9_]{1,60}$" },
        "descripcion": { "type": "string" },
        "procedencias_admitidas": { "type": "array", "minItems": 1, "items": { "enum": ["reproducido_local", "api_real", "participantes"] }, "description": "Solo procedencias reales acreditan ejecución." },
        "minimo_corridas": { "type": "integer", "minimum": 1 }
      }
    },
    "cifra": {
      "type": "object",
      "required": ["id", "etiqueta", "ruta", "agregacion", "unidad"],
      "additionalProperties": false,
      "properties": {
        "id": { "type": "string" }, "etiqueta": { "type": "string" }, "ruta": { "type": "string" },
        "agregacion": { "enum": ["min", "max", "suma", "unico", "conteo_distintos", "conteo_distintos_familia"] }, "unidad": { "type": "string" }
      }
    },
    "antecedente": {
      "type": "object",
      "required": ["id", "descripcion", "procedencia", "fuente", "cifras"],
      "additionalProperties": false,
      "properties": {
        "id": { "type": "string" },
        "descripcion": { "type": "string" },
        "procedencia": { "enum": ["reportado_historico", "simulado", "asistido_ia"], "description": "Un antecedente nunca acredita ejecución." },
        "fuente": { "type": "string", "minLength": 1 },
        "cifras": {
          "type": "array",
          "items": {
            "type": "object",
            "required": ["etiqueta", "valor", "unidad"],
            "additionalProperties": false,
            "properties": {
              "etiqueta": { "type": "string" }, "valor": { "type": "number" }, "unidad": { "type": "string" },
              "verificacion": {
                "type": "object",
                "required": ["tipo", "estricta"],
                "properties": {
                  "tipo": { "enum": ["json", "suma_longitudes"] }, "estricta": { "type": "boolean" },
                  "archivo": { "type": "string" }, "glob": { "type": "string" }, "ruta": { "type": "string" }
                },
                "additionalProperties": false
              }
            }
          }
        }
      }
    }
  }
}
