{
  "esquema": "mini-format/estudios/1",
  "objetivo": "OE4",
  "descripcion": "Registro de los estudios de validación (V1-V6b) y exploratorios (V7, V8) de mini-format. Dos ejes independientes: estado_ejecucion (pendiente | bloqueado | parcial | ejecutado) y resultado (no_evaluable | cumple | no_cumple). tools/evidencia.py estudios comprueba las reglas de honestidad: 'ejecutado' exige corridas ejecutadas de procedencia real (reproducido_local, api_real o participantes) para TODOS los componentes requeridos, y 'cumple' o 'no_cumple' se RECALCULAN desde los predicados del criterio sobre el resumen de esas corridas; si lo declarado difiere, es un error. Las cifras que se publican salen de evidencia/derivados/ (tools/evidencia.py regenerar), nunca de este archivo.",
  "clasificacion_metodologica": "V1-V5 controlados; V6a naturalista (operación en el contexto real de un sistema); V6b controlado con tareas estandarizadas; V7 y V8 exploratorios. 'Formativo' y 'sumativo' es otra dimensión (formativo durante el piloto, sumativo con la versión congelada).",
  "estudios": [
    {
      "id": "V1",
      "nombre": "Ahorro de tokens por formato",
      "objetivo": "OE4",
      "clasificacion": {"tipo": "controlado", "formativo_sumativo": "formativo durante el piloto; sumativo con la versión congelada"},
      "pregunta": "PI1: ¿cuántos tokens ahorra .mini frente a JSON y a otros formatos de serialización?",
      "procedimiento": "Congelar el corpus con manifiesto SHA-256; serializar cada documento en todas las representaciones; contar tokens con cada tokenizador; comprobar la ida y vuelta sin pérdida; analizar por celda (dominio x tamaño de lote), por dominio y en agregado con IC 95 %.",
      "muestra": {"unidad": "documento serializado (celda dominio x tamaño de lote x formato x tokenizador)", "descripcion": "14 dominios; lotes de 1, 5, 10, 25, 50, 100 y 250 registros más la línea base de n = 12; 4 conjuntos públicos congelados (1 902 objetos); 3 tokenizadores locales."},
      "comparadores": ["JSON compacto (principal)", "JSON legible", "YAML", "XML tipado", "CSV reversible", "TOON nativo", "TOON plano"],
      "criterio": {
        "texto": "I4.1: ahorro de tokens >= 30 % en >= 10 dominios y con tres tokenizadores.",
        "interpretacion": "El ahorro de un dominio con un tokenizador es la media, sobre los tamaños de lote de la serie principal, de 100 x (1 - T_mini / T_json_compacto), con T medido como conteo LOCAL de texto. Un dominio supera el umbral si esa media es >= 30 %. La meta se cumple si, con cada uno de >= 3 tokenizadores, >= 10 dominios superan el umbral. Lectura propuesta por la auditoría del 30/09/2026; pendiente de confirmación del equipo.",
        "fijado_utc": "2026-09-30T19:00:00Z",
        "aprobado_por_equipo": false,
        "predicados": [
          {"id": "dominios_que_superan", "descripcion": "Dominios con ahorro medio >= 30 % (el peor tokenizador)", "fuente": "resumen", "ruta": "dominios_que_superan_umbral_min_tokenizador", "agregacion": "min", "op": ">=", "valor": 10},
          {"id": "tokenizadores", "descripcion": "Tokenizadores medidos", "fuente": "resumen", "ruta": "tokenizadores_medidos", "agregacion": "min", "op": ">=", "valor": 3},
          {"id": "dominios_medidos", "descripcion": "Dominios medidos", "fuente": "resumen", "ruta": "dominios_medidos", "agregacion": "min", "op": ">=", "valor": 10}
        ]
      },
      "meta_documental": "V1 >= 30 % de ahorro en >= 10 dominios y con tres tokenizadores (Charter v5, I4.1).",
      "componentes": [
        {"id": "tokens_por_dominio_y_tokenizador", "descripcion": "Conteo de tokens de todos los formatos por dominio, tamaño de lote y tokenizador, con ida y vuelta", "procedencias_admitidas": ["reproducido_local"], "minimo_corridas": 1}
      ],
      "cifras": [
        {"id": "ahorro_medio_pct", "etiqueta": "Ahorro medio de tokens de .mini frente a JSON compacto", "ruta": "ahorro_medio_pct", "agregacion": "unico", "unidad": "%"}
      ],
      "limitaciones": [
        "tiktoken es una aproximación para Anthropic, Google y DeepSeek: solo es exacto para texto plano de los modelos de OpenAI que mapea.",
        "Conteo local de texto: no incluye los tokens de formato de mensaje ni el esquema de la solicitud, que sí cuenta el proveedor.",
        "Los cuatro conjuntos públicos y los 14 dominios del conjunto académico no son una muestra aleatoria de sistemas reales."
      ],
      "reproduccion": {"comando": "python experiments/v1_tokens/run.py", "nota": "Sin red ni API. Cada ejecución debe registrarse con tools/evidencia_lib.py (nueva_corrida/guardar_corrida) y parametros.componente = tokens_por_dominio_y_tokenizador."},
      "hu_relacionadas": ["HU105", "HU106", "HU107", "HU118"],
      "estado_ejecucion": "parcial",
      "resultado": "no_evaluable",
      "bloqueo": null,
      "antecedentes": [
        {"id": "v1-resultados-archivados", "descripcion": "Resultados de V1 archivados por celda (dominio, tamaño de lote, tokenizador) con IC 95 %, anteriores a los manifiestos de corrida: sin commit ni snapshot fijados.", "procedencia": "reportado_historico", "fuente": "experiments/v1_tokens/results/ahorro_resumen.csv", "cifras": []}
      ]
    },
    {
      "id": "V2",
      "nombre": "Validez y exactitud con varios modelos y proveedores",
      "objetivo": "OE4",
      "clasificacion": {"tipo": "controlado", "formativo_sumativo": "formativo durante el piloto; sumativo con la versión congelada"},
      "pregunta": "PI2: ¿.mini produce registros válidos y exactos con varios modelos de varios proveedores, antes y después de una reparación selectiva?",
      "procedimiento": "Diseño dominio x modelo x condición con orden aleatorizado por bloque; conservar todas las respuestas; una reparación como máximo sobre las líneas rechazadas; validez calculada sobre TODOS los registros solicitados (no solo los recibidos); separar validez sintáctica, de contrato y exactitud por campo.",
      "muestra": {"unidad": "respuesta de un modelo a una solicitud de N registros", "descripcion": "Mínimo comprometido: >= 3 modelos de >= 2 proveedores. Diseño ampliado: 14 dominios x 4 modelos (>= 3 proveedores) x 30 repeticiones x 4 condiciones (A-D, más D+1), con un máximo de 6 720 llamadas primarias."},
      "comparadores": ["A: JSON por instrucción mínima", "B: JSON con contrato en el prompt", "C: JSON nativo (si el proveedor lo admite)", "D: .mini sin reparación", "D+1: .mini con una reparación pareada sobre la misma D"],
      "criterio": {
        "texto": "I4.2: >= 95 % de registros válidos tras la reparación, con >= 3 modelos y >= 2 proveedores.",
        "interpretacion": "El porcentaje de válidos finales se calcula en la condición D+1 con denominador = TODOS los registros solicitados (incluidos los de respuestas cortadas o rechazadas), por modelo, con IC 95 %; el umbral de 95 % debe cumplirlo CADA modelo (el mínimo entre modelos). Cada corrida registrada corresponde a un modelo (modelo.proveedor y modelo.modelo_pedido). Lectura propuesta por la auditoría del 30/09/2026; pendiente de confirmación del equipo.",
        "fijado_utc": "2026-09-30T19:00:00Z",
        "aprobado_por_equipo": false,
        "predicados": [
          {"id": "validos_finales", "descripcion": "Válidos finales (D+1) sobre todos los solicitados: el peor modelo", "fuente": "resumen", "ruta": "validos_finales_pct_d1", "agregacion": "min", "op": ">=", "valor": 95},
          {"id": "modelos", "descripcion": "Modelos distintos medidos", "fuente": "corridas", "ruta": "modelo.modelo_pedido", "agregacion": "conteo_distintos", "op": ">=", "valor": 3},
          {"id": "proveedores", "descripcion": "Proveedores distintos medidos", "fuente": "corridas", "ruta": "modelo.proveedor", "agregacion": "conteo_distintos", "op": ">=", "valor": 2}
        ]
      },
      "meta_documental": "V2 >= 3 modelos de >= 2 proveedores (Charter v5, I4.2); diseño ampliado: 14 dominios x 4 modelos x 30 repeticiones x 4 condiciones con >= 3 proveedores.",
      "componentes": [
        {"id": "matriz_generacion_real", "descripcion": "Generación con modelos reales (llamadas autorizadas) con usage original y gasto registrado", "procedencias_admitidas": ["api_real"], "minimo_corridas": 3}
      ],
      "cifras": [
        {"id": "validos_iniciales_pct_d", "etiqueta": "Válidos antes de reparar (condición D), el peor modelo", "ruta": "validos_iniciales_pct_d", "agregacion": "min", "unidad": "%"}
      ],
      "limitaciones": [
        "No hay presupuesto de API autorizado: toda corrida real está bloqueada hasta que el usuario lo autorice.",
        "El arnés actual define el brazo A como separador con split ingenuo y no como JSON por instrucción mínima (comparador débil frente al Plan v3).",
        "La corrida con el proveedor simulado valida el arnés, nunca un modelo: no cuenta como evidencia del criterio.",
        "Los conteos de tiktoken son aproximación fuera de OpenAI: el costo y los tokens reales salen del usage de cada respuesta."
      ],
      "reproduccion": {"comando": "python experiments/generativo/run.py --config experiments/generativo/configs/estudio.yaml --adapter real --confirmar-real --max-costo-usd TOPE", "nota": "TOPE es el presupuesto que el usuario autorice explícitamente; sin él no se ejecuta. Antes: --dry-run."},
      "hu_relacionadas": ["HU108", "HU109", "HU110", "HU111", "HU118"],
      "estado_ejecucion": "bloqueado",
      "resultado": "no_evaluable",
      "bloqueo": {"causa": "Sin presupuesto de API autorizado ni claves: ninguna llamada de pago a APIs de modelos.", "desbloquea": "Autorización expresa del usuario de un tope de gasto y de los proveedores a usar."},
      "antecedentes": [